Question,Answer
Comment gérer un arrêt maladie pour un intermittent ? ,"Depuis 01/04/25, si intermittent sous contrat au moment de l’arrêt maladie : 
obligation de déclarer arrêt dans DSN mensuelle 
obligation de cotiser à aux congés spectacles sur la base de 80% de rémunération initialement prévue au contrat
pas d’obligation de maintien de salaire (sauf accord particulier)
Mise en garde : que pour arrêts déclarés par le salarié, notamment à France Travail (=Pole emploi)
Nécessite donc saisie d’un événement « arrêt de travail » (= déclenchement d’un bloc 60 dans DSN mensuelle)
Mise en garde : Aucune DSN événementielle à produire
Réalisation de la paie en suivant la fiche solution (avec utilisation rubriques Malin- et Malin-) (=cotiser à 80% des congés spectacles)"
"Un intermittent n’honore pas son contrat car il est en arrêt maladie. Puis-je lui maintenir son salaire ? Si « oui », suffit-il de faire la paie comme s’il avait travaillé ? ","pas d’obligation de maintien de salaire (sauf accord particulier)
mais possibilité de faire maintien si employeur le souhaite
paie particulière (différente de « comme s’il avait travaillé ») car maintien = autres rémunérations sur AEM
NB : nécessité de connaitre le montant des IJ pour réaliser la paie
cf. fiche solution « Arrêts maladie des salariés intermittents du spectacle » "
Je reçois une prolongation d’arrêt maladie d’un de mes salariés. Dois-je lui créer un nouvel arrêt ? ,"Pas de nouveau signalement à faire (=rien à redéposer)
Juste Décaler la date de fin de l’événement initial afin d’alimenter la dsn mensuelle"
"En exportant une DSN, j’ai cette anomalie « !! Diplôme préparé non renseigné pour un contrat d’apprentissage ».","pour apprentis, précision « diplôme préparé » est obligatoire pour DSN
double click sur l’erreur du contrôle de cohérence -> contrat
ouvrir contrat, passer en modification, renseigner « Diplôme » et valider
« valider correction » sur contrôle de cohérence"
J’ai oublié de faire une paie le mois dernier. Comment rattraper mon erreur ?,"Création paie avec dates réellement travaillées MAIS avec date de règlement sur le mois courant
La date de règlement sur le mois courant permet à la paie de partir avec DSN du mois courant"
"Mon salarié est en maladie depuis plus de 3 mois et je ne maintiens plus son salaire. Sur le mois de décembre, je vais faire une paie à zéro. Quelles rubriques dois-je utiliser ?","Rubrique pour déduction de l’absence sans maintien = AbMa
Mise en garde : rubrique paramétrée en 30e -> quantité égale à 30 pour mettre le mois à 0, même si mois de décembre = 31 jours.
Penser à forcer plafond à 0
Mise en garde 2 : les paies de maladies étant complexes, lire fiche solution et/ou appeler maintenance."